{"$schema":"https://json-schema.org/draft/2020-12/schema","$id":"provan.session10_handoff_finalization.v1","type":"object","required":["schema_id","state","reviewed_handoff","reviewed_pre_review_root","final_layer4_matrix","reviewer_receipts","reviewed_handoff_unchanged"],"properties":{"schema_id":{"const":"provan.session10_handoff_finalization.v1"},"state":{"const":"BOUND_REVIEWED_PRE_ROOT"},"reviewed_handoff":{"$ref":"#/$defs/reference"},"reviewed_pre_review_root":{"pattern":"^sha256:[0-9a-f]{64}$"},"final_layer4_matrix":{"$ref":"#/$defs/reference"},"reviewer_receipts":{"type":"array","minItems":2,"maxItems":2,"items":{"$ref":"#/$defs/reference"}},"reviewed_handoff_unchanged":{"const":true}},"$defs":{"reference":{"type":"object","required":["path","sha256"],"properties":{"path":{"type":"string","minLength":1},"sha256":{"pattern":"^sha256:[0-9a-f]{64}$"}},"additionalProperties":false}},"additionalProperties":false}
