{"final_layer4_matrix":{"path":"artifacts/session10/layer4_claim_matrix.final.v1.public.json","sha256":"sha256:396179d01a0cf3408e2d7e382679d4ccc8ac237f2228a77e7b4c22c4f4a2b7f7"},"reviewed_handoff":{"path":"artifacts/session10/session11_handoff.v1.public.json","sha256":"sha256:9ea084899a85cc34725e229f1d7bf72a6313026022382d1c9aad473ca7d88d12"},"reviewed_handoff_unchanged":true,"reviewed_pre_review_root":"sha256:1d7d7c0313ae231b61639374b0d8607698aa9e04b08ce8da8f1bb50dd6aa404e","reviewer_receipts":[{"path":"artifacts/session10/proofs/reviewer_receipt_a.v1.public.json","sha256":"sha256:453a5b517cd58e68525c855ba3f3f4baf9d418fb09d7ba18cc3435779ac3834b"},{"path":"artifacts/session10/proofs/reviewer_receipt_b.v1.public.json","sha256":"sha256:923280aea5f73c2c2041f719197ee7141962100fcbd38e146fb373cca6fc8067"}],"schema_id":"provan.session10_handoff_finalization.v1","state":"BOUND_REVIEWED_PRE_ROOT"}
